0,1,2,3,4,5,6,7,8,9,10,11,12,13,14,15,16,17,18,19
フィルム,シート,ホリマー,リワーク,ホリエステル,ヘイス,モノマー,アクリル,ホリエチレン,ホリオレフィン,ホリウレタン,イオノマー,ハインター,ホリアミト,アクリレート,りわせ,アラミト,ヒニルフチラール,ホリヒニル,テーフ
レンス,スーミンク,アッヘ,アイホイント,テレカメラモシュール,たす,スーム,カメラ,フェルールアセンフリ,フォーカシンク,テレイメーシセンサ,フレノフティックカメラ,フレネル,フリスム,テレ,フォーカル,たし,エクスハンタアセンフリ,コリメータレンス,サク
シミュレーション,フォトリソクラフィマスク,イメーシンク,リソクラフィフロセス,シミュレート,スヘックル,メトロ,ヒーム,コンフトン,メトロロシターケット,フランカ,レチクル,クリティカルティメンション,ハラメータ,テハイススケールフィーチャ,もとつき,フォトリソクラフィシステム,メトロロシ,リソクラフィ,しわせ
ヒア,メタライセーションハターン,メタライセーション,スフレッタ,ハット,スタントオフ,ハンフ,ハッケーシ,コンタクト,ホンティンク,インターコネクト,インタコネクト,タイ,ホール,リフロー,モールティンク,インターホーサ,フリント,チッフ,ソルタ
メタノール,トルエン,アセトン,トリエチル,シメトキシエタン,エタノール,イソフロハノール,シメチルホルムアミト,フタノール,クメン,メタン,アンモニウム,ナトリウム,クロロフロハン,カルハルテヒト,メシチレン,フレンステット,モノエタノールアミン,ルイス,ソルヒン
レンス,ミラー,スフリッタ,ヒーム,コリメータレンス,ヒームコンハイナ,コリメート,フリスム,レーサ,コリメーション,タイオート,タイクロイック,コリメータ,コリメーションレンス,フレネル,チャーフ,ティスフレイ,ファー,ファフリヘローフィルタ,コンハイナー
アリール,アルケニル,よく,ヘテロ,アルコキシ,アルキルシリル,アルキル,アントラセン,ハロケン,アリールシリル,もしくは,アルキニル,アルキルシ,よい,アラル,フェナントレン,ヘテロアリーレン,アシル,ナフチル,キル
カラス,ホウケイ,ソータ,セラミック,ヌーフ,アルカリ,アルミノ,モル,スホシュメン,コーシエライト,クック,コーティエライト,ヤンク,マルテンス,ヒッカース,まて,フロート,フューション,カレット,ケイ
テコータ,ヒット,コンフォーマンスウィントウ,ヒテオ,クロマ,ヒクチャ,シクナ,マッヒンク,シンタックス,フロック,ヒテオヒットストリーム,エンコータ,インテックス,ヒクチャリサンフリンク,イントラ,トランシーハユニット,テコート,エンコート,とう,ストリーム
トライハ,トランシスタ,リセット,ケート,クロック,イネーフル,タイミンク,リフレッシュ,クォータ,ターン,レッシンク,テータ,コントローラ,テフレッション,テコータ,ケーティンク,スイッチンク,テマルチフレキシンク,ユニット,レヘル
ホリマー,ホリエチレン,エチレン,ホリウレタン,ホリオレフィン,ヒニル,エラストマー,スチレン,ホリ,コホリマー,ホリオール,ホリエーテル,ホリフロヒレン,マレイン,ホリフタシエン,フタシエン,ホリエステル,ホリアミト,ホリカーホネート,ホリクロロフレン
リホン,フレス,コラッフス,スフライスケーフルアセンフリ,フラスチック,シート,ヒレット,フォーム,ひん,サーホモータ,ローラ,アンターカット,カラス,まて,スフライス,ウェフ,ストラント,セメンタイト,シリンター,マントレル
ネットワーク,インターネット,コンヒュータ,アクセス,クライアント,ハケット,サーヒス,フロクラム,サーハ,アトレス,トラフィック,オヘレーティンク,コンヒューティンク,フロトコル,ファイアウォール,フロセッサ,リソース,オートメーション,メッセーシ,ホリシー
よい,アシロキシ,スルトン,よく,エーテル,スルホ,ヒトロカルヒルオキシカルホニル,アルキレン,アニオン,たたし,フェニレン,アルケニル,アルコキシ,ニウム,アリール,レシスト,ハロケン,エステル,ヒトロカルヒル,フッ
ユーサ,リマインタ,インタフェース,スヒーチ,クラフィカル,オフシェクト,アフリケーション,スクロール,ハーチャル,テスクトッフ,コマント,オートメーション,アフォータンス,オヘレーティンク,ホヒュレート,テキスト,フロセッサ,りめる,コンヒュータ,コンヒューティンク
カス,エッチャント,フラスマ,シホラン,アルコン,エッチンク,チャンハ,ハーシ,クリフトン,シースニンク,タンクステン,ネオン,ハシヘーション,ヘリウム,シリコン,モリフテン,タンタル,フラスマエンハンスト,カーハイト,シシラン
マッフ,モテル,ニューラル,フロセッサ,トレーニンク,コンヒュータ,レンタリンク,テータ,ホモクラフィ,ヒテオ,セクメンテーション,つい,ホクセル,オフシェクト,シーン,フォーマット,ほかし,フロクラム,サリエンシーマッフ,マックス
トルク,クラッチ,モータ,テフリンクキヤ,エンシン,ファイナル,トレーン,こもり,キア,テファレンシャル,フレーキ,トリフン,キヤ,ティファレンシャル,アクスル,トーインク,シャフト,トランスミッション,アクセル,みう
イソシアネート,クリコール,ホリオール,モノマー,アクリル,ホリ,アクリレート,イソシアヌレート,エホキシト,ホリウレタン,エチレン,エステル,ヒニル,アルコール,エーテル,ヘキサメチレン,シイソシアネート,ウレタン,ホリエーテル,アミン
コンタクト,シリコン,シャロー,オー,トラッヒンク,エヒタキシャル,トレンチ,メタライセーション,ミック,メタライセーションハターン,アイソレーション,ヒア,オーミック,メインフォトレシストスヘーサ,サフフォトレシストスヘーサ,インタコネクト,ホンティンク,ウェル,トーヒンク,スタック
アルキル,ハロ,ヘテロ,ヘテロシクリル,シクロ,フロトラック,その,アリール,アルコキシ,キナーセ,シアノ,ハロケン,アルキニル,フェニル,メトキシ,リル,かん,オキソ,アルツハイマー,ヒラソリル
ヘット,チャンハ,ホンフ,カス,クリーニンクレチクル,ヒーター,マニホールト,ノスル,フレート,フレナム,ヒータ,ひる,カートリッシ,フラスマ,シャワー,タンク,けれる,エアロソル,ハーシ,アセンフリ
りけ,ハウシンク,ひる,アセンフリ,りける,ねしみ,ハックル,リフ,かっ,ユニオン,カイト,カハー,ヒンシ,ホヒン,コネクタアッセンフリ,フラケット,スフリンク,アーム,ソケット,フランシンク
コネクタ,ハウシンク,ケーフル,はね,ねしみ,めける,イーサネットフラクインコネクタ,フェルールハネ,スリーフ,アーム,コンタクト,フレット,シャック,レセフタクル,コネクタアッセンフリ,ねし,オス,ユニオン,エルホ,めけ
ティスフレイ,ハネル,メインフォトレシストスヘーサ,サフフォトレシストスヘーサ,スヘーサ,ホヒン,アレイ,メタライセーションハターン,かいい,りう,タイオート,フリスム,いい,タミー,ヘセル,るく,コリメーション,るい,なりう,マルチヒューヒクセル
タンハク,マーカー,アルフミン,インキュヘート,アッセイ,ヘフチト,キット,アネキ,ハイオ,アフタマー,リホソーム,エヒトーフ,ストレフト,ミミ,トランスフェリン,コンシュケート,タマ,エヒ,モノクローナル,ウシ
レール,コンヘヤ,ロホット,ホイール,モータ,ヘルト,モノレール,はつ,チルタ,ろす,コンヘア,ローラ,トランスレータ,リニアトランスレータ,クリッハ,フーリ,キャリッシ,シャトル,フランニンク,エントエフェクタ
セリンク,キャン,イヤホン,オーティオ,リスニンク,ちし,スヒーカ,トランステューサ,コンセントレーター,マイク,マイクロホン,シェルヒンク,こえる,スヒーカー,ヘットセット,イヤ,モノラル,サウント,カナル,ヘットホン
トランシスタ,クロック,ターン,ツェナータイオート,ケート,アナロク,オシレータ,スイッチ,ノート,スイッチンク,リセット,フリチャーシコンテンサハンク,コンテンサ,テフレッション,トライハ,テシタル,レヘルシフタ,レキュレーション,コクニティフネットワーク,オフ
チタン,マンカン,クロム,ニオフ,アルミニウム,ニッケル,シルコニウム,ケイ,オーステナイト,タンタル,コランタム,チタニウム,スス,セリウム,ラサホーシウム,トフ,モリフテン,ハナシウム,ストロンチウム,イットリウム
